Question,P1,P2,P3,P4,P5,P6,P7,P8,P9,P10
I think that I would like to use this system frequently,4,5,4,4,5,5,5,5,4,5
I found the system unnecessarily complex,2,1,1,3,1,2,3,1,1,3
I thought the system was easy to use,5,5,5,3,4,4,5,5,5,3
I think that I would need the support of a technical person to be able to use this system,1,1,2,4,1,1,1,1,1,1
I found the various functions in this system were well integrated,4,4,4,5,5,3,5,3,5,4
I thought there was too much inconsistency in this system,2,1,1,2,1,1,1,1,1,2
I would imagine that most people would learn to use this system very quickly,4,5,5,4,5,3,5,5,5,4
I found the system very cumbersome to use,1,1,2,2,1,3,1,1,1,1
I felt very confident using the system,5,5,5,4,5,5,4,4,5,4
I needed to learn a lot of things before I could get going with this system,2,1,2,3,2,1,1,1,1,1